{
  "$schema": "https://json-schema.org/draft/2020-12/schema",
  "title": "Smart Nudge terminal intelligence result v0.1.0",
  "description": "P0 contract; schema validity is not factual verification, authorization or proof of coverage.",
  "type": "object",
  "additionalProperties": false,
  "required": ["schema_version", "data_kind", "profile_id", "profile_version", "taxonomy_version", "entity_catalog_version", "rule_version", "run", "evidence", "claims", "events", "findings", "coverage"],
  "properties": {
    "schema_version": {"const": "0.1.0"},
    "data_kind": {"enum": ["synthetic", "live"]},
    "profile_id": {"$ref": "#/$defs/text"},
    "profile_version": {"$ref": "#/$defs/text"},
    "taxonomy_version": {"$ref": "#/$defs/text"},
    "entity_catalog_version": {"$ref": "#/$defs/text"},
    "rule_version": {"$ref": "#/$defs/text"},
    "run": {"$ref": "#/$defs/run"},
    "evidence": {"type": "array", "items": {"$ref": "#/$defs/evidence"}},
    "claims": {"type": "array", "items": {"$ref": "#/$defs/claim"}},
    "events": {"type": "array", "items": {"$ref": "#/$defs/event"}},
    "findings": {"type": "array", "items": {"$ref": "#/$defs/finding"}},
    "coverage": {"type": "array", "minItems": 1, "items": {"$ref": "#/$defs/coverage"}}
  },
  "$defs": {
    "text": {"type": "string", "minLength": 1, "pattern": "\\S"},
    "texts": {"type": "array", "uniqueItems": true, "items": {"$ref": "#/$defs/text"}},
    "ids": {"type": "array", "minItems": 1, "uniqueItems": true, "items": {"$ref": "#/$defs/text"}},
    "timestamp": {"type": "string", "format": "date-time", "pattern": "^\\d{4}-\\d{2}-\\d{2}T\\d{2}:\\d{2}:\\d{2}(\\.\\d+)?(Z|[+-]\\d{2}:\\d{2})$"},
    "nullable_timestamp": {"anyOf": [{"$ref": "#/$defs/timestamp"}, {"type": "null"}]},
    "nullable_date": {"anyOf": [{"type": "string", "format": "date"}, {"type": "null"}]},
    "nullable_text": {"anyOf": [{"$ref": "#/$defs/text"}, {"type": "null"}]},
    "run": {
      "type": "object", "additionalProperties": false,
      "required": ["run_id", "request_key", "as_of", "generated_at", "window", "scope", "status", "stop_reason", "errors", "agent_versions"],
      "properties": {
        "run_id": {"$ref": "#/$defs/text"},
        "request_key": {"$ref": "#/$defs/text"},
        "as_of": {"$ref": "#/$defs/timestamp"},
        "generated_at": {"$ref": "#/$defs/timestamp"},
        "window": {
          "type": "object", "additionalProperties": false, "required": ["start", "end", "timezone"],
          "properties": {"start": {"$ref": "#/$defs/timestamp"}, "end": {"$ref": "#/$defs/timestamp"}, "timezone": {"$ref": "#/$defs/text"}}
        },
        "scope": {
          "type": "object", "additionalProperties": false, "required": ["market_ids", "topic_ids", "source_classes"],
          "properties": {"market_ids": {"$ref": "#/$defs/ids"}, "topic_ids": {"$ref": "#/$defs/ids"}, "source_classes": {"$ref": "#/$defs/ids"}}
        },
        "status": {"enum": ["completed", "partial", "failed"]},
        "stop_reason": {"enum": ["sufficient_evidence", "no_new_independent_information", "budget_exhausted", "required_source_unavailable", "technical_failure"]},
        "errors": {"$ref": "#/$defs/texts"},
        "agent_versions": {"$ref": "#/$defs/texts"}
      }
    },
    "evidence": {
      "type": "object", "additionalProperties": false,
      "required": ["evidence_id", "url", "title", "publisher", "source_class", "origin", "origin_group_id", "published_at", "available_at", "retrieved_at", "retention", "excerpt", "native_citation"],
      "properties": {
        "evidence_id": {"$ref": "#/$defs/text"},
        "url": {"type": "string", "format": "uri", "pattern": "^https?://"},
        "title": {"$ref": "#/$defs/text"},
        "publisher": {"$ref": "#/$defs/text"},
        "source_class": {"enum": ["official", "company_disclosure", "professional_media", "research", "public_social_sample"]},
        "origin": {"enum": ["synthetic", "independent_public_source", "bing_grounding", "licensed_connector"]},
        "origin_group_id": {"$ref": "#/$defs/text"},
        "published_at": {"$ref": "#/$defs/nullable_timestamp"},
        "available_at": {"$ref": "#/$defs/timestamp"},
        "retrieved_at": {"$ref": "#/$defs/timestamp"},
        "retention": {"enum": ["synthetic", "approved_metadata_only", "approved_excerpt"]},
        "excerpt": {"$ref": "#/$defs/nullable_text"},
        "native_citation": {"type": ["object", "null"]}
      }
    },
    "support": {
      "type": "object", "additionalProperties": false,
      "required": ["evidence_id", "relation", "locator", "checked_by", "note"],
      "properties": {
        "evidence_id": {"$ref": "#/$defs/text"},
        "relation": {"enum": ["supports", "refutes", "context_only"]},
        "locator": {"$ref": "#/$defs/nullable_text"},
        "checked_by": {"enum": ["fixture_author", "human", "verification_agent", "not_checked"]},
        "note": {"$ref": "#/$defs/text"}
      }
    },
    "claim": {
      "type": "object", "additionalProperties": false,
      "required": ["claim_id", "statement", "kind", "verification", "supports"],
      "properties": {
        "claim_id": {"$ref": "#/$defs/text"},
        "statement": {"$ref": "#/$defs/text"},
        "kind": {"enum": ["fact", "reported_allegation", "observation"]},
        "verification": {"enum": ["supported", "unverified", "conflicted"]},
        "supports": {"type": "array", "minItems": 1, "items": {"$ref": "#/$defs/support"}}
      }
    },
    "event": {
      "type": "object", "additionalProperties": false,
      "required": ["event_id", "topic_id", "market_ids", "entity_ids", "claim_ids", "event_date", "effective_date", "first_seen_at", "change_type", "previous_event_id"],
      "properties": {
        "event_id": {"$ref": "#/$defs/text"}, "topic_id": {"$ref": "#/$defs/text"},
        "market_ids": {"$ref": "#/$defs/ids"}, "entity_ids": {"$ref": "#/$defs/texts"}, "claim_ids": {"$ref": "#/$defs/ids"},
        "event_date": {"$ref": "#/$defs/nullable_date"}, "effective_date": {"$ref": "#/$defs/nullable_date"}, "first_seen_at": {"$ref": "#/$defs/timestamp"},
        "change_type": {"enum": ["new", "updated", "unchanged", "corrected"]},
        "previous_event_id": {"$ref": "#/$defs/nullable_text"}
      }
    },
    "analysis": {
      "type": "object", "additionalProperties": false,
      "required": ["text", "basis_claim_ids", "assumptions", "unknowns"],
      "properties": {"text": {"$ref": "#/$defs/text"}, "basis_claim_ids": {"$ref": "#/$defs/ids"}, "assumptions": {"$ref": "#/$defs/texts"}, "unknowns": {"$ref": "#/$defs/texts"}}
    },
    "finding": {
      "type": "object", "additionalProperties": false,
      "required": ["finding_id", "event_id", "headline", "fact_claim_ids", "what_changed", "why_aia", "analysis", "importance", "importance_reason", "evidence_status", "decision", "decision_code", "decision_reason", "executive_questions"],
      "properties": {
        "finding_id": {"$ref": "#/$defs/text"}, "event_id": {"$ref": "#/$defs/text"}, "headline": {"$ref": "#/$defs/text"},
        "fact_claim_ids": {"$ref": "#/$defs/ids"}, "what_changed": {"$ref": "#/$defs/text"}, "why_aia": {"$ref": "#/$defs/text"},
        "analysis": {"$ref": "#/$defs/analysis"},
        "importance": {"enum": ["critical", "high", "medium", "low"]}, "importance_reason": {"$ref": "#/$defs/text"},
        "evidence_status": {"enum": ["primary_supported", "independently_corroborated", "signal_only", "conflicted", "unverifiable"]},
        "decision": {"enum": ["selected", "watch", "ignored"]},
        "decision_code": {"enum": ["select_verified_material", "watch_material_unverified", "watch_conflicting_evidence", "ignore_irrelevant", "ignore_duplicate", "ignore_low_value"]},
        "decision_reason": {"$ref": "#/$defs/text"}, "executive_questions": {"$ref": "#/$defs/texts"}
      }
    },
    "coverage": {
      "type": "object", "additionalProperties": false,
      "required": ["market_id", "topic_id", "source_class", "languages_checked", "status", "detail"],
      "properties": {
        "market_id": {"$ref": "#/$defs/text"}, "topic_id": {"$ref": "#/$defs/text"}, "source_class": {"$ref": "#/$defs/text"},
        "languages_checked": {"$ref": "#/$defs/texts"},
        "status": {"enum": ["checked", "partial", "unavailable", "not_attempted"]}, "detail": {"$ref": "#/$defs/text"}
      }
    }
  }
}
