{
  "schema_version": "0.1.0",
  "data_kind": "synthetic",
  "profile_id": "aia-group-ceo",
  "profile_version": "0.1.0",
  "taxonomy_version": "0.1.0",
  "entity_catalog_version": "0.1.0",
  "rule_version": "0.1.0",
  "run": {
    "run_id": "synthetic-p0-001",
    "request_key": "synthetic-profile-hk-regulatory-001",
    "as_of": "2026-09-02T09:00:00+08:00",
    "generated_at": "2026-09-02T09:05:00+08:00",
    "window": {"start": "2026-09-01T00:00:00+08:00", "end": "2026-09-02T09:00:00+08:00", "timezone": "Asia/Hong_Kong"},
    "scope": {"market_ids": ["HK"], "topic_ids": ["regulatory-change"], "source_classes": ["official"]},
    "status": "completed",
    "stop_reason": "sufficient_evidence",
    "errors": [],
    "agent_versions": []
  },
  "evidence": [
    {
      "evidence_id": "e-synthetic-1",
      "url": "https://regulator.example/consultations/synthetic-001",
      "title": "虚构测试文件：销售披露咨询",
      "publisher": "虚构监管机构，仅用于测试",
      "source_class": "official",
      "origin": "synthetic",
      "origin_group_id": "synthetic-release-001",
      "published_at": "2026-09-01T12:00:00+08:00",
      "available_at": "2026-09-01T12:00:00+08:00",
      "retrieved_at": "2026-09-02T08:55:00+08:00",
      "retention": "synthetic",
      "excerpt": "【合成内容】拟调整长期保险销售披露，公开征求意见；正式生效日期尚未确定。",
      "native_citation": null
    }
  ],
  "claims": [
    {
      "claim_id": "c-synthetic-1",
      "statement": "【合成事实】虚构机构发布销售披露咨询，尚未确定正式生效日期。",
      "kind": "fact",
      "verification": "supported",
      "supports": [{"evidence_id": "e-synthetic-1", "relation": "supports", "locator": "合成文件第 1 段", "checked_by": "fixture_author", "note": "只证明咨询发布，不证明义务已生效；非真实来源。"}]
    }
  ],
  "events": [
    {
      "event_id": "event-synthetic-1",
      "topic_id": "regulatory-change",
      "market_ids": ["HK"],
      "entity_ids": ["aia-hk-business"],
      "claim_ids": ["c-synthetic-1"],
      "event_date": "2026-09-01",
      "effective_date": null,
      "first_seen_at": "2026-09-02T08:55:00+08:00",
      "change_type": "new",
      "previous_event_id": null
    }
  ],
  "findings": [
    {
      "finding_id": "finding-synthetic-1",
      "event_id": "event-synthetic-1",
      "headline": "【合成示例】销售披露咨询值得跟踪，尚未生效",
      "fact_claim_ids": ["c-synthetic-1"],
      "what_changed": "合成测试中新增一项咨询；不代表真实监管动态。",
      "why_aia": "假设后续规则适用于相关长期保险销售，可能需要评估香港业务的披露流程。",
      "analysis": {
        "text": "仅示范有条件的业务解释：若最终规定改变披露内容，相关业务或需调整材料及培训。",
        "basis_claim_ids": ["c-synthetic-1"],
        "assumptions": ["适用性仅是案例设定，不是对真实 AIA 的法律判断。"],
        "unknowns": ["最终条文、生效时间和实际经营影响未知。"]
      },
      "importance": "high",
      "importance_reason": "案例设定为覆盖主要销售流程的潜在变化，不以新闻热度判断。",
      "evidence_status": "primary_supported",
      "decision": "selected",
      "decision_code": "select_verified_material",
      "decision_reason": "所选事实仅为咨询已经发布；不把未来政策结果写成既成事实。",
      "executive_questions": ["若进入正式规则，哪些披露流程需要进一步评估？"]
    }
  ],
  "coverage": [
    {"market_id": "HK", "topic_id": "regulatory-change", "source_class": "official", "languages_checked": ["zh-Hant", "en"], "status": "checked", "detail": "合成覆盖记录，没有执行任何真实搜索，也不表示已经连接该来源。"}
  ]
}
